{
  "component": "Sponsor logo",
  "machineName": "sponsor-logo",
  "source": {
    "sourceRef": "web/themes/custom/demo/components/sponsor-logo/sponsor-logo.component.yml"
  },
  "path": "/home",
  "verificationUrl": "https://demo.ddev.site/home",
  "linkUrl": "https://www.example.org/home",
  "rootSelector": "[data-component-id=\"demo:sponsor-logo\"]",
  "extractedAt": "2026-09-23T13:26:27.472Z",
  "measurements": {
    "desktop:default": {
      "rootBox": {
        "width": 307.53,
        "height": 275
      },
      "nodes": [
        {
          "path": "/a[0]",
          "tag": "a",
          "classes": [
            "demo-sponsor-logo",
            "demo-sponsor-logo--fit"
          ],
          "id": null,
          "attributes": {
            "href": "https://sponsor.example.org/"
          },
          "text": null,
          "box": {
            "x": 0,
            "y": 0,
            "width": 307.53,
            "height": 275
          },
          "computed": {
            "display": "block",
            "position": "static",
            "boxSizing": "border-box",
            "overflow": "visible",
            "flexDirection": "row",
            "flexWrap": "nowrap",
            "justifyContent": "normal",
            "alignItems": "normal",
            "alignSelf": "auto",
            "gap": "normal",
            "rowGap": "normal",
            "columnGap": "normal",
            "flexGrow": "0",
            "flexShrink": "1",
            "flexBasis": "auto",
            "gridTemplateColumns": "none",
            "gridTemplateRows": "none",
            "width": "307.531px",
            "height": "275px",
            "minWidth": "auto",
            "maxWidth": "100%",
            "minHeight": "auto",
            "maxHeight": "none",
            "paddingTop": "0px",
            "paddingRight": "0px",
            "paddingBottom": "0px",
            "paddingLeft": "0px",
            "marginTop": "0px",
            "marginRight": "0px",
            "marginBottom": "0px",
            "marginLeft": "0px",
            "fontFamily": "\"PT Sans\", sans-serif",
            "fontSize": "14px",
            "fontWeight": "400",
            "fontStyle": "normal",
            "lineHeight": "23.8px",
            "letterSpacing": "normal",
            "textAlign": "center",
            "textTransform": "none",
            "textDecorationLine": "none",
            "color": "rgb(192, 0, 0)",
            "backgroundColor": "rgba(0, 0, 0, 0)",
            "backgroundImage": "none",
            "backgroundSize": "auto",
            "backgroundPosition": "0% 0%",
            "backgroundRepeat": "repeat",
            "borderTopWidth": "0px",
            "borderRightWidth": "0px",
            "borderBottomWidth": "0px",
            "borderLeftWidth": "0px",
            "borderTopStyle": "solid",
            "borderRightStyle": "solid",
            "borderBottomStyle": "solid",
            "borderLeftStyle": "solid",
            "borderTopColor": "rgb(192, 0, 0)",
            "borderRightColor": "rgb(192, 0, 0)",
            "borderBottomColor": "rgb(192, 0, 0)",
            "borderLeftColor": "rgb(192, 0, 0)",
            "borderTopLeftRadius": "0px",
            "borderTopRightRadius": "0px",
            "borderBottomLeftRadius": "0px",
            "borderBottomRightRadius": "0px",
            "boxShadow": "none",
            "opacity": "1",
            "transform": "none",
            "transition": "all",
            "zIndex": "auto",
            "listStyleType": "disc",
            "objectFit": "fill",
            "aspectRatio": "auto",
            "visibility": "visible"
          },
          "declared": {
            "color": "var(--demo-link)"
          },
          "before": null,
          "after": null,
          "svg": null,
          "image": null,
          "inlineText": null
        },
        {
          "path": "/a[0]/img[1]",
          "tag": "img",
          "classes": [
            "image"
          ],
          "id": null,
          "attributes": {
            "src": "/sites/default/files/demo-reference/sponsor-logo-example.png?alternateWidths=/sites/default/files/styles/canvas_parametrized_width--%7Bwidth%7D/public/demo-reference/sponsor-logo-example.png.avif%3Fitok%3DexampleTk",
            "alt": "Example School District"
          },
          "text": null,
          "box": {
            "x": 0,
            "y": 0,
            "width": 307.53,
            "height": 275
          },
          "computed": {
            "display": "block",
            "position": "static",
            "boxSizing": "border-box",
            "overflow": "clip",
            "flexDirection": "row",
            "flexWrap": "nowrap",
            "justifyContent": "normal",
            "alignItems": "normal",
            "alignSelf": "auto",
            "gap": "normal",
            "rowGap": "normal",
            "columnGap": "normal",
            "flexGrow": "0",
            "flexShrink": "1",
            "flexBasis": "auto",
            "gridTemplateColumns": "none",
            "gridTemplateRows": "none",
            "width": "307.531px",
            "height": "275px",
            "minWidth": "0px",
            "maxWidth": "100%",
            "minHeight": "0px",
            "maxHeight": "none",
            "paddingTop": "0px",
            "paddingRight": "0px",
            "paddingBottom": "0px",
            "paddingLeft": "0px",
            "marginTop": "0px",
            "marginRight": "0px",
            "marginBottom": "0px",
            "marginLeft": "0px",
            "fontFamily": "\"PT Sans\", sans-serif",
            "fontSize": "14px",
            "fontWeight": "400",
            "fontStyle": "normal",
            "lineHeight": "23.8px",
            "letterSpacing": "normal",
            "textAlign": "center",
            "textTransform": "none",
            "textDecorationLine": "none",
            "color": "rgb(192, 0, 0)",
            "backgroundColor": "rgba(0, 0, 0, 0)",
            "backgroundImage": "none",
            "backgroundSize": "auto",
            "backgroundPosition": "0% 0%",
            "backgroundRepeat": "repeat",
            "borderTopWidth": "0px",
            "borderRightWidth": "0px",
            "borderBottomWidth": "0px",
            "borderLeftWidth": "0px",
            "borderTopStyle": "solid",
            "borderRightStyle": "solid",
            "borderBottomStyle": "solid",
            "borderLeftStyle": "solid",
            "borderTopColor": "rgb(192, 0, 0)",
            "borderRightColor": "rgb(192, 0, 0)",
            "borderBottomColor": "rgb(192, 0, 0)",
            "borderLeftColor": "rgb(192, 0, 0)",
            "borderTopLeftRadius": "0px",
            "borderTopRightRadius": "0px",
            "borderBottomLeftRadius": "0px",
            "borderBottomRightRadius": "0px",
            "boxShadow": "none",
            "opacity": "1",
            "transform": "none",
            "transition": "all",
            "zIndex": "auto",
            "listStyleType": "disc",
            "objectFit": "contain",
            "aspectRatio": "auto 189 / 169",
            "visibility": "visible"
          },
          "declared": {},
          "before": null,
          "after": null,
          "svg": null,
          "image": {
            "src": "https://demo.ddev.site/sites/default/files/styles/canvas_parametrized_width--256/public/demo-reference/sponsor-logo-example.png.avif?itok=exampleTk",
            "naturalWidth": 227,
            "naturalHeight": 203
          },
          "inlineText": null
        }
      ]
    },
    "tablet:default": {
      "rootBox": {
        "width": 307.53,
        "height": 275
      },
      "nodes": [
        {
          "path": "/a[0]",
          "tag": "a",
          "classes": [
            "demo-sponsor-logo",
            "demo-sponsor-logo--fit"
          ],
          "id": null,
          "attributes": {
            "href": "https://sponsor.example.org/"
          },
          "text": null,
          "box": {
            "x": 0,
            "y": 0,
            "width": 307.53,
            "height": 275
          },
          "computed": {
            "display": "block",
            "position": "static",
            "boxSizing": "border-box",
            "overflow": "visible",
            "flexDirection": "row",
            "flexWrap": "nowrap",
            "justifyContent": "normal",
            "alignItems": "normal",
            "alignSelf": "auto",
            "gap": "normal",
            "rowGap": "normal",
            "columnGap": "normal",
            "flexGrow": "0",
            "flexShrink": "1",
            "flexBasis": "auto",
            "gridTemplateColumns": "none",
            "gridTemplateRows": "none",
            "width": "307.531px",
            "height": "275px",
            "minWidth": "auto",
            "maxWidth": "100%",
            "minHeight": "auto",
            "maxHeight": "none",
            "paddingTop": "0px",
            "paddingRight": "0px",
            "paddingBottom": "0px",
            "paddingLeft": "0px",
            "marginTop": "0px",
            "marginRight": "0px",
            "marginBottom": "0px",
            "marginLeft": "0px",
            "fontFamily": "\"PT Sans\", sans-serif",
            "fontSize": "14px",
            "fontWeight": "400",
            "fontStyle": "normal",
            "lineHeight": "23.8px",
            "letterSpacing": "normal",
            "textAlign": "center",
            "textTransform": "none",
            "textDecorationLine": "none",
            "color": "rgb(192, 0, 0)",
            "backgroundColor": "rgba(0, 0, 0, 0)",
            "backgroundImage": "none",
            "backgroundSize": "auto",
            "backgroundPosition": "0% 0%",
            "backgroundRepeat": "repeat",
            "borderTopWidth": "0px",
            "borderRightWidth": "0px",
            "borderBottomWidth": "0px",
            "borderLeftWidth": "0px",
            "borderTopStyle": "solid",